{
  "schema_version": "1.0.0",
  "contract_version": "3.0.0",
  "queue_version": "0.1.0",
  "queue_id": "W0-FIRST-WAVE-QUESTION-REVIEW",
  "authority_status": "NON_AUTHORITATIVE_REVIEW_QUEUE",
  "source_catalog_path": "contracts/questions/question_catalog_candidate.json",
  "source_catalog_sha256": "7b78496dbf66f8f09ef6458635b5d8c6902a722d0bc38ff271ec988d522ea1c8",
  "family_order": [
    "SV",
    "EP",
    "MI",
    "VC",
    "CY",
    "OR"
  ],
  "expected_count": 150,
  "review_required_count": 150,
  "approved_count": 0,
  "adopted_count": 0,
  "runtime_pass_count": 0,
  "live_authorized": false,
  "items": [
    {
      "review_ordinal": 1,
      "catalog_ordinal": 688,
      "question_id": "SV-001",
      "family": "SV",
      "question_version": "UNBOUND",
      "source_section": "İstatistiksel Geçerlilik ve Ardışık Çıkarım — SV",
      "question_text": "Araştırmada denenmiş tüm strateji, özellik, hedef, ufuk ve parametrelerin birleşik trial evreni değişmez biçimde kaydediliyor mu?",
      "source_status": "YENİ / ÖNERİLEN",
      "review_status": "REVIEW_REQUIRED",
      "applicability": "UNBOUND",
      "criticality": "UNBOUND",
      "scope_hash": "UNBOUND",
      "information_class": "UNKNOWN",
      "answer_status": "UNKNOWN",
      "execution_status": "NOT_EXECUTED",
      "contract_id": "UNBOUND",
      "policy_id": "UNBOUND",
      "test_id": "UNBOUND",
      "scenario_id": "UNBOUND",
      "evidence_id": "UNBOUND",
      "observation_window": "UNBOUND",
      "fail_action": "UNBOUND",
      "owner": "UNBOUND",
      "approver": "UNBOUND",
      "independent_approval_status": "NOT_EXECUTED",
      "decision_record_id": "UNBOUND",
      "recertification_status": "NOT_EXECUTED"
    },
    {
      "review_ordinal": 2,
      "catalog_ordinal": 689,
      "question_id": "SV-002",
      "family": "SV",
      "question_version": "UNBOUND",
      "source_section": "İstatistiksel Geçerlilik ve Ardışık Çıkarım — SV",
      "question_text": "İnsan tarafından manuel elenen denemeler de search budget ve selection pressure hesabına giriyor mu?",
      "source_status": "YENİ / ÖNERİLEN",
      "review_status": "REVIEW_REQUIRED",
      "applicability": "UNBOUND",
      "criticality": "UNBOUND",
      "scope_hash": "UNBOUND",
      "information_class": "UNKNOWN",
      "answer_status": "UNKNOWN",
      "execution_status": "NOT_EXECUTED",
      "contract_id": "UNBOUND",
      "policy_id": "UNBOUND",
      "test_id": "UNBOUND",
      "scenario_id": "UNBOUND",
      "evidence_id": "UNBOUND",
      "observation_window": "UNBOUND",
      "fail_action": "UNBOUND",
      "owner": "UNBOUND",
      "approver": "UNBOUND",
      "independent_approval_status": "NOT_EXECUTED",
      "decision_record_id": "UNBOUND",
      "recertification_status": "NOT_EXECUTED"
    },
    {
      "review_ordinal": 3,
      "catalog_ordinal": 690,
      "question_id": "SV-003",
      "family": "SV",
      "question_version": "UNBOUND",
      "source_section": "İstatistiksel Geçerlilik ve Ardışık Çıkarım — SV",
      "question_text": "White Reality Check veya eşdeğer veri-snooping düzeltmesinin uygulanabilirliği politika ile belirlenmiş mi?",
      "source_status": "YENİ / ÖNERİLEN",
      "review_status": "REVIEW_REQUIRED",
      "applicability": "UNBOUND",
      "criticality": "UNBOUND",
      "scope_hash": "UNBOUND",
      "information_class": "UNKNOWN",
      "answer_status": "UNKNOWN",
      "execution_status": "NOT_EXECUTED",
      "contract_id": "UNBOUND",
      "policy_id": "UNBOUND",
      "test_id": "UNBOUND",
      "scenario_id": "UNBOUND",
      "evidence_id": "UNBOUND",
      "observation_window": "UNBOUND",
      "fail_action": "UNBOUND",
      "owner": "UNBOUND",
      "approver": "UNBOUND",
      "independent_approval_status": "NOT_EXECUTED",
      "decision_record_id": "UNBOUND",
      "recertification_status": "NOT_EXECUTED"
    },
    {
      "review_ordinal": 4,
      "catalog_ordinal": 691,
      "question_id": "SV-004",
      "family": "SV",
      "question_version": "UNBOUND",
      "source_section": "İstatistiksel Geçerlilik ve Ardışık Çıkarım — SV",
      "question_text": "Hansen SPA veya eşdeğer üstün tahmin testi, çok sayıdaki zayıf alternatifin etkisini ele alıyor mu?",
      "source_status": "YENİ / ÖNERİLEN",
      "review_status": "REVIEW_REQUIRED",
      "applicability": "UNBOUND",
      "criticality": "UNBOUND",
      "scope_hash": "UNBOUND",
      "information_class": "UNKNOWN",
      "answer_status": "UNKNOWN",
      "execution_status": "NOT_EXECUTED",
      "contract_id": "UNBOUND",
      "policy_id": "UNBOUND",
      "test_id": "UNBOUND",
      "scenario_id": "UNBOUND",
      "evidence_id": "UNBOUND",
      "observation_window": "UNBOUND",
      "fail_action": "UNBOUND",
      "owner": "UNBOUND",
      "approver": "UNBOUND",
      "independent_approval_status": "NOT_EXECUTED",
      "decision_record_id": "UNBOUND",
      "recertification_status": "NOT_EXECUTED"
    },
    {
      "review_ordinal": 5,
      "catalog_ordinal": 692,
      "question_id": "SV-005",
      "family": "SV",
      "question_version": "UNBOUND",
      "source_section": "İstatistiksel Geçerlilik ve Ardışık Çıkarım — SV",
      "question_text": "DSR hesabı deneme sayısı, çarpıklık, basıklık ve seri bağımlılık girdilerini eksiksiz kullanıyor mu?",
      "source_status": "YENİ / ÖNERİLEN",
      "review_status": "REVIEW_REQUIRED",
      "applicability": "UNBOUND",
      "criticality": "UNBOUND",
      "scope_hash": "UNBOUND",
      "information_class": "UNKNOWN",
      "answer_status": "UNKNOWN",
      "execution_status": "NOT_EXECUTED",
      "contract_id": "UNBOUND",
      "policy_id": "UNBOUND",
      "test_id": "UNBOUND",
      "scenario_id": "UNBOUND",
      "evidence_id": "UNBOUND",
      "observation_window": "UNBOUND",
      "fail_action": "UNBOUND",
      "owner": "UNBOUND",
      "approver": "UNBOUND",
      "independent_approval_status": "NOT_EXECUTED",
      "decision_record_id": "UNBOUND",
      "recertification_status": "NOT_EXECUTED"
    },
    {
      "review_ordinal": 6,
      "catalog_ordinal": 693,
      "question_id": "SV-006",
      "family": "SV",
      "question_version": "UNBOUND",
      "source_section": "İstatistiksel Geçerlilik ve Ardışık Çıkarım — SV",
      "question_text": "PBO/CSCV tasarımı zamansal bağımlılığı ve strateji seçim sürecini bozmayacak şekilde uygulanıyor mu?",
      "source_status": "YENİ / ÖNERİLEN",
      "review_status": "REVIEW_REQUIRED",
      "applicability": "UNBOUND",
      "criticality": "UNBOUND",
      "scope_hash": "UNBOUND",
      "information_class": "UNKNOWN",
      "answer_status": "UNKNOWN",
      "execution_status": "NOT_EXECUTED",
      "contract_id": "UNBOUND",
      "policy_id": "UNBOUND",
      "test_id": "UNBOUND",
      "scenario_id": "UNBOUND",
      "evidence_id": "UNBOUND",
      "observation_window": "UNBOUND",
      "fail_action": "UNBOUND",
      "owner": "UNBOUND",
      "approver": "UNBOUND",
      "independent_approval_status": "NOT_EXECUTED",
      "decision_record_id": "UNBOUND",
      "recertification_status": "NOT_EXECUTED"
    },
    {
      "review_ordinal": 7,
      "catalog_ordinal": 694,
      "question_id": "SV-007",
      "family": "SV",
      "question_version": "UNBOUND",
      "source_section": "İstatistiksel Geçerlilik ve Ardışık Çıkarım — SV",
      "question_text": "Bootstrap veya yeniden örnekleme blok uzunluğu önceden tanımlı ve bağımlılık yapısına uygun mu?",
      "source_status": "YENİ / ÖNERİLEN",
      "review_status": "REVIEW_REQUIRED",
      "applicability": "UNBOUND",
      "criticality": "UNBOUND",
      "scope_hash": "UNBOUND",
      "information_class": "UNKNOWN",
      "answer_status": "UNKNOWN",
      "execution_status": "NOT_EXECUTED",
      "contract_id": "UNBOUND",
      "policy_id": "UNBOUND",
      "test_id": "UNBOUND",
      "scenario_id": "UNBOUND",
      "evidence_id": "UNBOUND",
      "observation_window": "UNBOUND",
      "fail_action": "UNBOUND",
      "owner": "UNBOUND",
      "approver": "UNBOUND",
      "independent_approval_status": "NOT_EXECUTED",
      "decision_record_id": "UNBOUND",
      "recertification_status": "NOT_EXECUTED"
    },
    {
      "review_ordinal": 8,
      "catalog_ordinal": 695,
      "question_id": "SV-008",
      "family": "SV",
      "question_version": "UNBOUND",
      "source_section": "İstatistiksel Geçerlilik ve Ardışık Çıkarım — SV",
      "question_text": "Çapraz varlık, çapraz strateji ve ortak olay bağımlılığı etkin örnek büyüklüğünde hesaba katılıyor mu?",
      "source_status": "YENİ / ÖNERİLEN",
      "review_status": "REVIEW_REQUIRED",
      "applicability": "UNBOUND",
      "criticality": "UNBOUND",
      "scope_hash": "UNBOUND",
      "information_class": "UNKNOWN",
      "answer_status": "UNKNOWN",
      "execution_status": "NOT_EXECUTED",
      "contract_id": "UNBOUND",
      "policy_id": "UNBOUND",
      "test_id": "UNBOUND",
      "scenario_id": "UNBOUND",
      "evidence_id": "UNBOUND",
      "observation_window": "UNBOUND",
      "fail_action": "UNBOUND",
      "owner": "UNBOUND",
      "approver": "UNBOUND",
      "independent_approval_status": "NOT_EXECUTED",
      "decision_record_id": "UNBOUND",
      "recertification_status": "NOT_EXECUTED"
    },
    {
      "review_ordinal": 9,
      "catalog_ordinal": 696,
      "question_id": "SV-009",
      "family": "SV",
      "question_version": "UNBOUND",
      "source_section": "İstatistiksel Geçerlilik ve Ardışık Çıkarım — SV",
      "question_text": "Örtüşen label ve pozisyon süreleri bağımsız gözlemmiş gibi sayılmıyor mu?",
      "source_status": "YENİ / ÖNERİLEN",
      "review_status": "REVIEW_REQUIRED",
      "applicability": "UNBOUND",
      "criticality": "UNBOUND",
      "scope_hash": "UNBOUND",
      "information_class": "UNKNOWN",
      "answer_status": "UNKNOWN",
      "execution_status": "NOT_EXECUTED",
      "contract_id": "UNBOUND",
      "policy_id": "UNBOUND",
      "test_id": "UNBOUND",